doi,title
10.1109/TVCG.2019.2934797,VisTA: Integrating Machine Intelligence with Visualization to Support the Investigation of Think-Aloud Sessions
10.1109/TVCG.2019.2934283,What is Interaction for Data Visualization?
10.1109/TVCG.2019.2934811,Winglets: Visualizing Association with Uncertainty in Multi-class Scatterplots
10.1111/cgf.13671,A framework for GPU-accelerated exploration of massive time-varying rectilinear scalar volumes
10.1111/cgf.13699,A Geometric Optimization Approach for the Detection and Segmentation of Multiple Aneurysms
10.1111/cgf.13730,A Review of Guidance Approaches in Visual Data Analysis: A Multifocal Perspective
10.1111/cgf.13723,A stable graph layout algorithm for processes
10.1111/cgf.13688,A Visual Tool for the Analysis of Algorithms for Tomographic Fiber Reconstruction in Materials Science
10.1111/cgf.13680,An Exploratory User Study of Visual Causality Analysis
10.1111/cgf.13690,An Interactive Visualization System for Large Sets of Phase Space Trajectories
10.1111/cgf.13677,An Ontological Framework for Supporting the Design and Evaluation of Visual Analytics Systems
10.1111/cgf.13706,Analysis of Decadal Climate Predictions with User-guided Hierarchical Ensemble Clustering
10.1111/cgf.13701,Analysis of Long Molecular Dynamics Simulations Using Interactive Focus+Context Visualization
10.1111/cgf.13716,Augmenting Tactile 3D Data Navigation With Pressure Sensing
10.1111/cgf.13713,Bird's-Eye - Large-Scale Visual Analytics of City Dynamics using Social Location Data
10.1111/cgf.13696,Bridging the Data Analysis Communication Gap Utilizing a Three-Component Summarized Line Graph
10.1111/cgf.13720,Capture & Analysis of Active Reading Behaviors for Interactive Articles on the Web
10.1111/cgf.13678,Characterizing Exploratory Visual Analysis: A Literature Review and Evaluation of Analytic Provenance in Tableau
10.1111/cgf.13697,ChronoCorrelator: Enriching Events with Time Series
10.1111/cgf.13684,ClustMe: A Visual Quality Measure for Ranking Monochrome Scatterplots based on Cluster Patterns
10.1111/cgf.13675,CV3: Visual Exploration, Assessment, and Comparison of CVs
10.1111/cgf.13709,Designing Animated Transitions to Convey Aggregate Operations
10.1111/cgf.13674,DIVA: Exploration and Validation of Hypothesized Drug-Drug Interactions
10.1111/cgf.13722,Efficient Optimal Overlap Removal: Algorithms and Experiments
10.1111/cgf.13707,Evaluating image quality measures to assess the impact of lossy data compression applied to climate simulation data
10.1111/cgf.13695,Examining Implicit Discretization in Spectral Schemes
10.1111/cgf.13711,Focus+Context Exploration of Hierarchical Embeddings
10.1111/cgf.13670,Follow The Clicks: Learning and Anticipating Mouse Interactions During Exploratory Data Analysis
10.1111/cgf.13710,Hybrid Touch/Tangible Spatial 3D Data Selection
10.1111/cgf.13705,IGM-Vis: Analyzing Intergalactic and Circumgalactic Medium Absorption Using Quasar Sightlines in a Cosmic Web Context
10.1111/cgf.13717,InsideInsights: Integrating Data-Driven Reporting in Collaborative Visual Analytics
10.1111/cgf.13669,Interactive Visualization of Flood and Heavy Rain Simulations
10.1111/cgf.13700,Interactive Volumetric Visual Analysis of Glycogen-derived Energy Absorption in Nanometric Brain Structures
10.1111/cgf.13679,Investigating Effects of Visual Anchors on Decision-Making about Misinformation
10.1111/cgf.13718,Investigating the Manual View Specification and Visualization by Demonstration Paradigms for Visualization Construction
10.1111/cgf.13708,Kyrix: Interactive Pan/Zoom Visualizations at Scale
10.1111/cgf.13672,Latent Space Cartography: Visual Analysis of Vector Space Embeddings
10.1111/cgf.13719,Linking and Layout: Exploring the Integration of Text and Visualization in Storytelling
10.1111/cgf.13673,Multiple Views: different meanings and collocated words
10.1111/cgf.13721,netflower: Dynamic Network Visualization for Data Journalists
10.1111/cgf.13668,Optimizing Stepwise Animation in Dynamic Set Diagrams
10.1111/cgf.13683,Oui! Outlier Interpretation on Multi-dimensional Data via Visual Analytics
10.1111/cgf.13703,Ray Tracing Generalized Tube Primitives: Method and Applications
10.1111/cgf.13712,Route-Aware Edge Bundling for Visualizing Origin-Destination Trails in Urban Traffic
10.1111/cgf.13715,Segmentifier: Interactive Refinement of Clickstream Data
10.1111/cgf.13732,State-of-the-art in Multi-Light Image Collections for Surface Visualization and Analysis
10.1111/cgf.13726,State-of-the-Art Report: Visual Computing in Radiation Therapy Planning
10.1111/cgf.13685,SurgeryCuts: Embedding Additional Information in Maps without Occluding Features
10.1111/cgf.13687,The Dependent Vectors Operator
10.1111/cgf.13731,The State of the Art in Visual Analysis Approaches for Ocean and Atmospheric Datasets
10.1111/cgf.13714,Topic Tomographies (TopTom): a visual approach to distill information from media streams
10.1111/cgf.13682,Toward Understanding Representation Methods in Visualization Recommendations through Scatterplot Construction Tasks
10.1111/cgf.13692,Towards Glyphs for Uncertain Symmetric Second-Order Tensors
10.1111/cgf.13667,V-Awake: A Visual Analytics Approach for Correcting Sleep Predictions from Deep Learning Models
10.1111/cgf.13676,VIAN: A Visual Annotation Tool for Film Analysis
10.1111/cgf.13704,Visual Analysis of Charge Flow Networks for Complex Morphologies
10.1111/cgf.13698,Visual-Interactive Preprocessing of Multivariate Time Series Data
10.1111/cgf.13691,Visualization of Equivalence in 2D Bivariate Fields
10.1111/cgf.13694,Visualization Support for Developing a Matrix Calculus Algorithm: A Case Study
10.1111/cgf.13686,Visualizing for the Non-Visual: Enabling the Visually Impaired to Use Visualization
10.1109/TVCG.2018.2864844,A Visual Analytics Framework for Spatiotemporal Trade Network Analysis
10.1109/TVCG.2018.2865026,A Visual Analytics Framework for the Detection of Anomalous Call Stack Trees in High Performance Computing Applications
10.1109/TVCG.2018.2865025,An Information-Theoretic Approach to the Cost-benefit Analysis of Visualization in Virtual Environments
10.1109/TVCG.2018.2864843,An Interactive Method to Improve Crowdsourced Annotations
10.1109/TVCG.2018.2864811,Analysis of Flight Variability: a Systematic Approach
10.1109/TVCG.2018.2864814,BitExTract: Interactive Visualization for Extracting Bitcoin Exchange Intelligence
10.1109/TVCG.2018.2864905,Doccurate: A Curation-Based Approach for Clinical Text Visualization
10.1109/TVCG.2018.2864504,DQNViz: A Visual Analytics Approach to Understand Deep Q-Networks
10.1109/TVCG.2018.2865051,Drag and Track: A Direct Manipulation Interface for Contextualizing Data Instances within a Continuous Parameter Space
10.1109/VAST.2018.8802454,EmbeddingVis: A Visual Analytics Approach to Comparative Network Embedding Inspection
10.1109/TVCG.2018.2865039,Enhancing Web-based Analytics Applications through Provenance
10.1109/TVCG.2018.2864825,EnsembleLens: Ensemble-based Visual Exploration of Anomaly Detection Algorithms with Multidimensional Data
10.1109/TVCG.2018.2865020,Evaluating Multi-Dimensional Visualizations for Understanding Fuzzy Clusters
10.1109/TVCG.2018.2865041,ForVizor: Visualizing Spatio-Temporal Team Formations in Soccer
10.1109/TVCG.2018.2865040,Futzing and Moseying: Interviews with Professional Data Analysts on Exploration Practices
10.1109/TVCG.2018.2865021,GraphProtector: A Visual Interface for Employing and Assessing Multiple Privacy Preserving Graph Algorithms
10.1109/TVCG.2018.2865042,Identification of Temporally Varying Areas of Interest in Long-Duration Eye-Tracking Data Sets
10.1109/TVCG.2018.2864475,iForest: Interpreting Random Forests via Visual Analytics
10.1109/TVCG.2018.2864887,InkPlanner: Supporting Prewriting via Intelligent Visual Diagramming
10.1109/TVCG.2018.2865024,KnowledgePearls: Provenance-Based Visualization Retrieval
10.1109/TVCG.2018.2865023,Lessons Learned Developing a Visual Analytics Solution for Investigative Analysis of Scamming Activities
10.1109/TVCG.2018.2864499,Manifold: A Model-Agnostic Framework for Interpretation and Diagnosis of Machine Learning Models
10.1109/TVCG.2018.2865049,MotionRugs: Visualizing Collective Trends in Space and Time
10.1109/TVCG.2018.2865043,RegressionExplorer: Interactive Exploration of Logistic Regression Models with Subgroup Analysis
10.1109/TVCG.2018.2865027,RetainVis: Visual Analytics with Interpretable and Interactive Recurrent Neural Networks on Electronic Medical Records
10.1109/TVCG.2018.2864812,RuleMatrix: Visualizing and Understanding Classifiers with Rules
10.1109/TVCG.2018.2865044,Seq2Seq-Vis: A Visual Debugging Tool for Sequence-to-Sequence Models
10.1109/TVCG.2018.2865047,SIRIUS: Dual, Symmetric, Interactive Dimension Reductions
10.1109/TVCG.2018.2865029,Situ: Identifying and Explaining Suspicious Behavior in Networks
10.1109/VAST.2018.8802486,SMARTexplore: Simplifying High-Dimensional Data Analysis through a Table-Based Visual Analytics Approach
10.1109/VAST.2018.8802449,The Effect of Proximity in Social Data Charts on Perceived Unity
10.1109/VAST.2018.8802424,The Effect of Semantic Interaction on Foraging in Text Analysis
10.1109/TVCG.2018.2865018,TPFlow: Progressive Partition and Multidimensional Pattern Extraction for Large-Scale Spatio-Temporal Data Analysis
10.1109/TVCG.2018.2864826,VIBR: Visualizing Bipartite Relations at Scale with the Minimum Description Length Principle
10.1109/TVCG.2018.2865022,VIS Author Profiles: Interactive Descriptions of Publication Records Combining Text and Visualization
10.1109/TVCG.2018.2864838,VIS4ML: An Ontology for Visual Analytics Assisted Machine Learning
10.1109/TVCG.2018.2864503,Visual Abstraction of Large Scale Geospatial Origin-Destination Movement Data
10.1109/TVCG.2018.2864901,Visual Analysis of the Temporal Evolution of Ensemble Forecast Sensitivities
10.1109/TVCG.2018.2864769,Visual Analytics for Topic Model Optimization based on User-Steerable Speculative Execution
10.1109/TVCG.2018.2864885,Visual Progression Analysis of Event Sequence Data
10.1109/TVCG.2018.2865028,Vulnus: Visual Vulnerability Analysis for Network Security
10.1109/VAST.2018.8802383,VUSphere: Visual Analysis of Video Utilization in Online Distance Education
10.1109/TVCG.2018.2864841,A Declarative Grammar of Flexible Volume Visualization Pipelines
10.1109/TVCG.2018.2864853,A Study of the Trade-off Between Reducing Precision and Reducing Resolution for Data Analysis and Visualization
10.1109/TVCG.2018.2864815,An Interactive Framework for Visualization of Weather Forecast Ensembles
10.1109/TVCG.2018.2864801,CoDDA: A Flexible Copula-based Distribution Driven Analysis Framework for Large-Scale Multivariate Data
10.1109/TVCG.2018.2864850,CPU Isosurface Ray Tracing of Adaptive Mesh Refinement Data
10.1109/TVCG.2018.2864847,Culling for Extreme-Scale Segmentation Volumes: A Hybrid Deterministic and Probabilistic Approach
10.1109/TVCG.2018.2864498,Deadeye: A Novel Preattentive Visualization Technique Based on Dichoptic Presentation
10.1109/TVCG.2018.2864849,Details-First, Show Context, Overview Last: Supporting Exploration of Viscous Fingers in Large-Scale Ensemble Simulations
10.1109/TVCG.2018.2864845,DT-MRI Streamsurfaces Revisited
10.1109/TVCG.2018.2864510,Dynamic Volume Lines: Visual Comparison of 3D Volumes through Space-filling Curves
10.1109/TVCG.2018.2864808,Exploring Time-Varying Multivariate Volume Data Using Matrix of Isosurface Similarity Maps
10.1109/TVCG.2018.2864656,Firefly: Virtual Illumination Drones for Interactive Visualization
10.1109/TVCG.2018.2864508,Gaia Sky: Navigating the Gaia Catalog
10.1109/TVCG.2018.2864827,Hexahedral Mesh Structure Visualization and Evaluation
10.1109/TVCG.2018.2864806,Interactive 3D Visual Analysis of Atmospheric Fronts
10.1109/TVCG.2018.2864690,Interactive obstruction-free lensing for volumetric data visualization
10.1109/TVCG.2018.2864816,Interactive Visualization of 3D Histopathology in Native Resolution
10.1109/TVCG.2018.2864507,Interactive Visualization of RNA and DNA Structures
10.1109/TVCG.2018.2864491,Labels on Levels: Labeling of Multi-Scale Multi-Instance and Crowded 3D Biological Environments
10.1109/TVCG.2018.2864828,Objective Vortex Corelines of Finite-sized Objects in Fluid Flows
10.1109/TVCG.2018.2864505,Probabilistic Asymptotic Decider for Topological Ambiguity Resolution in Level-Set Extraction for Uncertain 2D Data
10.1109/TVCG.2018.2864813,Recirculation Surfaces for Flow Visualization
10.1109/TVCG.2018.2864768,Robust and Fast Extraction of 3D Symmetric Tensor Field Topology
10.1109/TVCG.2018.2864848,Shared-Memory Parallel Computation of Morse-Smale Complexes with Improved Accuracy
10.1109/TVCG.2018.2864846,Tensor Field Visualization using Fiber Surfaces of Invariant Space
10.1109/TVCG.2018.2864839,Time-Dependent Flow seen through Approximate Observer Killing Fields
10.1109/TVCG.2018.2864509,Visual Analysis of Aneurysm Data using Statistical Graphics
10.1109/TVCG.2018.2864817,Visual Analysis of Spatia-temporal Relations of Pairwise Attributes in Unsteady Flow
10.1109/TVCG.2018.2864506,Visualization of Bubble Formation in Porous Media
10.1109/TVCG.2018.2864851,Visualization of Large Molecular Trajectories
10.1109/TVCG.2018.2864852,Visualization of Neuronal Structures in Wide-Field Microscopy Brain Images
10.1109/TVCG.2018.2865141,A Declarative Rendering Model for Multiclass Density Maps
10.1109/TVCG.2018.2864913,A Framework for Externalizing Implicit Error Using Visualization
10.1109/TVCG.2018.2865146,A Heuristic Approach to Value-Driven Evaluation of Visualizations
10.1109/TVCG.2018.2865145,Augmenting Visualizations with Interactive Data Facts to Facilitate Interpretation and Communication
10.1109/TVCG.2018.2865158,Charticulator: Interactive Construction of Bespoke Chart Layouts
10.1109/TVCG.2018.2865077,Comparing Similarity Perception in Time Series Visualizations
10.1109/TVCG.2018.2864836,Design Exposition with Literate Visualization
10.1109/TVCG.2018.2865194,DimReader: Axis lines that explain non-linear projections
10.1109/TVCG.2018.2865152,DXR: A Toolkit for Building Immersive Data Visualizations
10.1109/TVCG.2018.2865159,Dynamic Composite Data Physicalization Using Wheeled Micro-Robots
10.1109/TVCG.2018.2865119,Elastic Documents: Coupling Text and Tables through Contextual Visualizations for Enhanced Document Reading
10.1109/TVCG.2018.2865075,Embedded Merge & Split: Visual Adjustment of Data Grouping
10.1109/TVCG.2018.2864884,Face to Face: Evaluating Visual Comparison
10.1109/TVCG.2018.2865191,FiberClay: Sculpting Three Dimensional Trajectories to Reveal Structural Insights
10.1109/TVCG.2018.2865142,Glanceable Visualization: Studies of Data Comparison Performance on Smartwatches
10.1109/TVCG.2018.2865151,Graphicle: Exploring Units, Networks, and Context in a Blended Visualization Approach
10.1109/TVCG.2018.2864909,Hypothetical Outcome Plots Help Untrained Observers Judge Trends in Ambiguous Data
10.1109/TVCG.2018.2865076,IDMVis: Temporal Event Sequence Visualization for Type 1 Diabetes Treatment Decision Support
10.1109/TVCG.2018.2865266,Image-Based Aspect Ratio Selection
10.1109/TVCG.2018.2864889,In Pursuit of Error: A Survey of Uncertainty Visualization Evaluation
10.1109/TVCG.2018.2865237,Information Olfactation: Harnessing Scent to Convey Data
10.1109/TVCG.2018.2864899,iStoryline: Effective Convergence to Hand-drawn Storylines
10.1109/TVCG.2018.2865149,Juniper: A Tree+Table Approach to Multivariate Graph Visualization
10.1109/TVCG.2018.2864907,Looks Good To Me: Visualizations As Sanity Checks
10.1109/TVCG.2018.2865147,Mapping Color to Meaning in Colormap Data Visualizations
10.1109/TVCG.2018.2865233,Mitigating the Attraction Effect with Visualizations
10.1109/TVCG.2018.2865235,Multiple Coordinated Views at Large Displays for Multiple Users: Empirical Findings on User Behavior, Movements, and Distances
10.1109/TVCG.2018.2865232,Narvis: Authoring Narrative Slideshows for Introducing Data Visualization Designs
10.1109/TVCG.2018.2865230,NLIZE: A Perturbation-Driven Visual Interrogation Tool for Analyzing and Interpreting Natural Language Inference Models
10.1109/TVCG.2018.2864912,Optimizing Color Assignment for Perception of Class Separability in Multiclass Scatterplots
10.1109/TVCG.2018.2865117,Patterns and Pace: Quantifying Diverse Exploration Behavior with Visualizations on the Web
10.1109/TVCG.2018.2865118,Shape-preserving Star Coordinates
10.1109/TVCG.2018.2865231,SmartCues: A Multitouch Query Approach for Details-on-Demand through Dynamically Computed Overlays
10.1109/TVCG.2018.2865126,SRVis: Towards Better Spatial Integration in Ranking Visualization
10.1109/TVCG.2018.2864911,Structure-aware Fisheye Views for Efficient Large Graph Exploration
10.1109/TVCG.2018.2865139,Structure-Based Suggestive Exploration: A New Approach for Effective Exploration of Large Networks
10.1109/TVCG.2018.2865265,Temporal Treemaps: Static Visualization of Evolving Trees
10.1109/TVCG.2018.2865144,Vistrates: A Component Model for Ubiquitous Analytics
10.1109/TVCG.2018.2865234,Visualizing Ranges over Time on Mobile Phones: A Task-Based Crowdsourced Evaluation
10.1109/TVCG.2018.2865193,Visualizing Uncertain Tropical Cyclone Predictions using Representative Samples from Ensembles of Forecast Tracks
10.1109/TVCG.2018.2864903,What Do We Talk About When We Talk About Dashboards?
10.1109/TVCG.2018.2864914,Where's My Data? Evaluating Visualizations with Missing Data
10.1111/cgf.13426,A General Illumination Model for Molecular Visualization
10.1111/cgf.13445,A Survey of Flattening-Based Medical Visualization Techniques
10.1111/cgf.13422,An Approximate Parallel Vectors Operator for Multiple Vector Fields
10.1111/cgf.13427,Analyzing Residue Surface Proximity to Interpret Molecular Dynamics
10.1111/cgf.13409,Assessing Effects of Task and Data Distribution on the Effectiveness of Visual Encodings
10.1111/cgf.13436,Baseball Timeline: Summarizing Baseball Plays Into a Static Visualization
10.1111/cgf.13413,Bladder Runner: Visual Analytics for the Exploration of RT-Induced Bladder Toxicity in a Cohort Study
10.1111/cgf.13433,CFGExplorer: Designing a Visual Control Flow Analytics System around Basic Program Analysis Operations
10.1111/cgf.13400,ChangeCatcher: Increasing Inter-author Awareness for Visualization Development
10.1111/cgf.13402,Chart Constellations: Effective Chart Summarization for Collaborative and Multi-User Analyses
10.1111/cgf.13414,ConcaveCubes: Supporting Cluster-based Geographical Visualization in Large Data Scale
10.1111/cgf.13423,Core Lines in 3D Second-Order Tensor Fields
10.1111/cgf.13437,Cosine-Weighted B-Spline Interpolation on the Face-Centered Cubic Lattice
10.1111/cgf.13408,Design Factors for Summary Visualization in Visual Analytics
10.1111/cgf.13429,DimSUM: Dimension and Scale Unifying Map for Visual Abstraction of DNA Origami Structures
10.1111/cgf.13411,Explorative Blood Flow Visualization using Dynamic Line Filtering based on Surface Features
10.1111/cgf.13407,Exploring the Visualization Design Space with Repertory Grids
10.1111/cgf.13405,Fast and Accurate CNN-based Brushing in Scatterplots
10.1111/cgf.13396,Hierarchical Correlation Clustering in Multiple 2D Scalar Fields
10.1111/cgf.13435,Hunting High and Low: Visualising Shifting Correlations in Financial Markets
10.1111/cgf.13415,Hypersliceplorer: Interactive visualization of shapes in multiple dimensions
10.1111/cgf.13434,Illustrative Multivariate Visualization for Geological Modelling
10.1111/cgf.13444,Information Visualization Evaluation Using Crowdsourcing
10.1111/cgf.13417,Interactive Analysis of Word Vector Embeddings
10.1111/cgf.13442,Interactive Investigation of Traffic Congestion on Fat-Tree Networks Using TreeScope
10.1111/cgf.13404,Interactive Visual Exploration of Local Patterns in Large Scatterplot Spaces
10.1111/cgf.13399,Key Time Steps Selection for Large-Scale Time-Varying Volume Datasets Using an Information-Theoretic Storyboard
10.1111/cgf.13441,Multiscale Visualization and Exploration of Large Bipartite Graphs
10.1111/cgf.13418,PixelSNE: Pixel-Aligned Stochastic Neighbor Embedding for Efficient 2D Visualization with Screen-Resolution Precision
10.1111/cgf.13446,Quality Metrics for Information Visualization
10.1111/cgf.13439,Rendering and Extracting Extremal Features in 3D Fields
10.1111/cgf.13397,Representative Consensus from Limited-Size Ensembles
10.1111/cgf.13440,SetCoLa: High-Level Constraints for Graph Layout
10.1111/cgf.13438,Spatio-Temporal Contours from Deep Volume Raycasting
10.1111/cgf.13447,State of the Art of Sports Data Visualization
10.1111/cgf.13410,The Perception of Graph Properties in Graph Layouts
10.1111/cgf.13425,ThreadReconstructor: Modeling Reply-Chains to Untangle Conversational Text through Visual Analytics
10.1111/cgf.13398,Time Lattice: A Data Structure for the Interactive Visual Analysis of Large Time Series
10.1111/cgf.13401,Towards Easy Comparison of Local Businesses Using Online Reviews
10.1111/cgf.13406,Towards User-Centered Active Learning Algorithms
10.1111/cgf.13430,VirtualDesk: A Comfortable and Efficient Immersive Information Visualization Approach
10.1111/cgf.13428,Visual Analysis of protein-ligand interactions
10.1111/cgf.13412,Visual and quantitative analysis of great arteries' blood flow jets in cardiac 4D PC-MRI data
10.1111/cgf.13421,Visualization of 4D Vector Field Topology
10.1111/cgf.13403,Visualizing Expanded Query Results
10.1111/cgf.13419,Visualizing Multidimensional Data with Order Statistics
10.1111/cgf.13420,Visualizing the Phase Space of Heterogeneous Inertial Particles in 2D Flows
10.1109/TVCG.2017.2745139,A Utility-Aware Visual Approach for Anonymizing Multi-Attribute Tabular Data
10.1109/VAST.2017.8585646,A Visual Analytics System for Optimizing Communications in Massively Parallel Applications
10.1109/TVCG.2017.2744718,ActiVis: Visual Exploration of Industry-Scale Deep Neural Network Models
10.1109/TVCG.2017.2744938,Analyzing the Training Processes of Deep Generative Models
10.1109/TVCG.2017.2744684,Applying Pragmatics Principles for Interaction with Visual Analytics
10.1109/TVCG.2017.2745180,Beyond Tasks: An Activity Typology for Visual Analytics
10.1109/TVCG.2017.2744458,BiDots: Visual Exploration of Weighted Biclusters
10.1109/TVCG.2017.2745181,Bring It to the Pitch: Combining Video and Movement Data to Enhance Team Sport Analysis
10.1109/TVCG.2017.2744322,Clustering Trajectories by Relevant Parts for Air Traffic Analysis
10.1109/TVCG.2017.2745085,Clustervision: Visual Supervision of Unsupervised Clustering
10.1109/TVCG.2017.2744818,Comparing Visual-Interactive Labeling with Active Learning: An Experimental Study
10.1109/TVCG.2017.2744478,ConceptVector: Text Visual Analytics via Interactive Lexicon Building Using Word Embedding
10.1109/VAST.2017.8585484,CRICTO: Supporting Sensemaking through Crowdsourced Information Schematization
10.1109/VAST.2017.8585658,CrystalBall: A Visual Analytic System for Future Event Discovery and Analysis from Social Media Data
10.1109/TVCG.2017.2744358,DeepEyes: Progressive Visual Analytics for Designing Deep Neural Networks
10.1109/VAST.2017.8585638,E-Map: A Visual Analytics Approach for Exploring Significant Event Evolutions in Social Media
10.1109/TVCG.2017.2744758,EVA: Visual Analytics to Identify Fraudulent Events
10.1109/TVCG.2017.2745320,EventThread: Visual Summarization and Stage Analysis of Event Sequence Data
10.1109/TVCG.2017.2744843,Graphiti: Interactive Specification of Attribute-Based Edges for Network Modeling and Visualization
10.1109/TVCG.2017.2744080,How Do Ancestral Traits Shape Family Trees Over Generations?
10.1109/VAST.2017.8585505,Interactive Visual Alignment of Medieval Text Versions
10.1109/TVCG.2017.2744098,LDSScanner: Exploratory Analysis of Low-Dimensional Structures in High-Dimensional Datasets
10.1109/VAST.2017.8585613,Pattern Trails: Visual Analysis of Pattern Transitions in Subspaces
10.1109/TVCG.2017.2745118,PhenoLines: Phenotype Comparison Visualizations for Disease Subtyping via Topic Models
10.1109/TVCG.2017.2745078,Podium: Ranking Data Using Mixed-Initiative Visual Analytics
10.1109/TVCG.2017.2745080,Progressive Learning of Topic Modeling Parameters: A Visual Analytics Framework
10.1109/VAST.2017.8585733,QSAnglyzer: Visual Analytics for Prismatic Analysis of Question Answering System Evaluations
10.1109/TVCG.2017.2745083,Sequence Synopsis: Optimize Visual Summary of Temporal Event Data
10.1109/TVCG.2017.2744738,SkyLens: Visual Analysis of Skyline on Multi-Dimensional Data
10.1109/TVCG.2017.2744805,SOMFlow: Guided Exploratory Cluster Analysis with Self-Organizing Maps and Analytic Provenance
10.1109/TVCG.2017.2745279,Supporting Handoff in Asynchronous Collaborative Sensemaking Using Knowledge-Transfer Graphs
10.1109/VAST.2017.8585487,The "y" of it Matters, Even for Storyline Visualization
10.1109/VAST.2017.8585665,The Anchoring Effect in Decision-Making with Visual Analytics
10.1109/TVCG.2017.2743990,The Interactive Visualization Gap in Initial Exploratory Data Analysis
10.1109/VAST.2017.8585498,The Role of Explicit Knowledge: A Conceptual Model of Knowledge-Assisted Visual Analytics
10.1109/TVCG.2017.2745258,Towards a Systematic Combination of Dimension Reduction and Clustering in Visual Analytics
10.1109/TVCG.2017.2745158,TreePOD: Sensitivity-Aware Selection of Pareto-Optimal Decision Trees
10.1109/TVCG.2017.2744686,Understanding a Sequence of Sequences: Visual Exploration of Categorical States in Lake Sediment Cores
10.1109/TVCG.2017.2744418,Understanding the Relationship Between Interactive Optimisation and Visual Analytics in the Context of Prostate Brachytherapy
10.1109/TVCG.2017.2744898,VIGOR: Interactive Visual Exploration of Graph Query Results
10.1109/VAST.2017.8585647,Visual Causality Analysis Made Practical
10.1109/TVCG.2017.2744378,Visual Diagnosis of Tree Boosting Methods
10.1109/TVCG.2017.2744685,Visualizing Big Data Outliers Through Distributed Aggregation
10.1109/TVCG.2017.2745178,Visualizing Confidence in Cluster-Based Ensemble Weather Forecast Analyses
